{
  "source_system": "calendar",
  "source_object_id": "gcal:beta-scope-0826",
  "source_event_key": "scheduled",
  "occurred_at": "2026-08-20T11:00:00Z",
  "connector": "google_calendar",
  "connector_version": "0.1.0",
  "payload": {
    "kind": "calendar_event",
    "event_id": "gcal:beta-scope-0826",
    "title": "Beta support rollout scoping",
    "start": "2026-08-26T16:00:00Z",
    "end": "2026-08-26T16:45:00Z",
    "status": "scheduled",
    "organizer": {"email": "dana@ghostvendor.com", "name": "Dana Kim"},
    "attendees": [
      {"email": "dana@ghostvendor.com", "name": "Dana Kim", "response": "accepted"},
      {"email": "leo@ghostvendor.com", "name": "Leo Park", "response": "accepted"},
      {"email": "hannah.lee@beta.io", "name": "Hannah Lee", "response": "needs_action"}
    ],
    "crm_opportunity_ref": "opp:BE-7-EXP"
  }
}
