{
  "source_system": "crm",
  "source_object_id": "opp:AC-4-EXP",
  "source_event_key": "field:StageName:Technical evaluation",
  "occurred_at": "2026-09-25T09:30:00Z",
  "connector": "salesforce",
  "connector_version": "0.1.0",
  "payload": {
    "kind": "crm_change",
    "object_type": "Opportunity",
    "record_id": "opp:AC-4-EXP",
    "account_record_id": "account:AC-4",
    "changed_at": "2026-09-25T09:30:00Z",
    "changed_by": "dana@vendor.example",
    "created": false,
    "fields": {"StageName": {"old": "Commercial review", "new": "Technical evaluation"}}
  }
}
