{
  "source_system": "enrichment",
  "source_object_id": "peoplegraph:ravi.menon@beta.io:2026-09-12T06:00:00Z",
  "source_event_key": "observed",
  "occurred_at": "2026-09-12T06:00:00Z",
  "connector": "peoplegraph",
  "connector_version": "0.1.0",
  "payload": {
    "kind": "enrichment",
    "provider": "peoplegraph",
    "subject": {"email": "ravi.menon@beta.io", "domain": null},
    "observed_at": "2026-09-12T06:00:00Z",
    "facts": {
      "title": "Senior Engineering Manager",
      "employer_domain": "globex.com",
      "seniority": "manager"
    }
  }
}
